{
  "schema_version": "1.0",
  "kind": "archive-manifest",
  "id": "synthetic-example",
  "plan_id": "PLAN-001",
  "reason": "synthetic-example",
  "merge_evidence_ref": null,
  "artifacts": [
    {
      "path": "synthetic-example",
      "sha256": "bbbbbbbbbbbbbbbbbbbbbbbbbbbbbbbbbbbbbbbbbbbbbbbbbbbbbbbbbbbbbbbb"
    }
  ],
  "retained_commit_oids": [],
  "created_at": "2026-09-05T00:00:00Z"
}
